{
  "absolute_delta": null,
  "base_release": "unsloth-qwen3-8-27b-gguf",
  "base_score": null,
  "benchmark_id": "unresolved",
  "benchmark_version": null,
  "evaluation_settings_match": false,
  "evidence_ids": [],
  "evidence_quality": "unknown",
  "metric": null,
  "metric_direction": null,
  "notes": "no evaluation evidence for either release; No exact base-release evaluation is available for this artifact, so retention stays unknown rather than inherited.",
  "publisher_claim": null,
  "quant_score": null,
  "quantization": "BF16",
  "quantized_artifact": "unsloth-qwen3-8-27b-gguf",
  "relative_delta": null,
  "retention_id": "ret-v1-3199c653c40a9e4a1a3faea0cf1bbea614291ee51564c0dc3cdb31258e17f061",
  "retention_status": "unknown",
  "schema_version": "0.6.0",
  "source": null,
  "verification_status": null
}
